{
  "schema_version": 1,
  "ticker": "CAG",
  "period": "2025-FY",
  "period_start": "2024-05-27",
  "period_end": "2025-05-25",
  "period_type": "annual",
  "currency": "USD",
  "scale": "million",
  "consolidation": "consolidated",
  "audit_status": "audited",
  "accounting_basis": "US_GAAP",
  "inflation_adjustment": {
    "status": "not_applicable",
    "standard": null
  },
  "restatement": {
    "status": "original",
    "restated_from_publication_date": null
  },
  "publication_date": "2026-07-15",
  "source_revision": "0001104659-26-083905",
  "rounding": "Prior-year YTD comparison column normalized from the cited SEC 10-Q to million USD.",
  "income_statement": [
    {
      "metric_id": "revenue_total",
      "name": "Net Revenue",
      "value": 11612.8,
      "unit": "million_usd",
      "period": "2025-FY",
      "comparison_value": null,
      "comparison_period": null,
      "change": null,
      "change_unit": null,
      "data_type": "direct",
      "status": "available",
      "reason": null,
      "provenance": {
        "source_file": "raw/sec-filings/CAG/0001104659-26-083905.json",
        "source_type": "sec_inline_xbrl",
        "source_id": "sec-0001104659-26-083905",
        "page": null,
        "sheet": "income_statement",
        "cell_or_range": "http://fasb.org/us-gaap/2025:RevenueFromContractWithCustomerExcludingAssessedTax#Duration_5_27_2024_To_5_25_2025_6f5macFeNEWHTQoY1aecyA",
        "formula": null,
        "notes": "SEC accession 0001104659-26-083905; prior-year YTD comparison column embedded in the current 10-Q."
      }
    },
    {
      "metric_id": "cost_of_sales",
      "name": "Cost of Sales",
      "value": -8609.3,
      "unit": "million_usd",
      "period": "2025-FY",
      "comparison_value": null,
      "comparison_period": null,
      "change": null,
      "change_unit": null,
      "data_type": "direct",
      "status": "available",
      "reason": null,
      "provenance": {
        "source_file": "raw/sec-filings/CAG/0001104659-26-083905.json",
        "source_type": "sec_inline_xbrl",
        "source_id": "sec-0001104659-26-083905",
        "page": null,
        "sheet": "income_statement",
        "cell_or_range": "http://fasb.org/us-gaap/2025:CostOfGoodsAndServicesSold#Duration_5_27_2024_To_5_25_2025_6f5macFeNEWHTQoY1aecyA",
        "formula": null,
        "notes": "SEC accession 0001104659-26-083905; prior-year YTD comparison column embedded in the current 10-Q."
      }
    },
    {
      "metric_id": "gross_profit",
      "name": "Gross Profit",
      "value": 3003.5,
      "unit": "million_usd",
      "period": "2025-FY",
      "comparison_value": null,
      "comparison_period": null,
      "change": null,
      "change_unit": null,
      "data_type": "direct",
      "status": "available",
      "reason": null,
      "provenance": {
        "source_file": "raw/sec-filings/CAG/0001104659-26-083905.json",
        "source_type": "sec_inline_xbrl",
        "source_id": "sec-0001104659-26-083905",
        "page": null,
        "sheet": "income_statement",
        "cell_or_range": "http://fasb.org/us-gaap/2025:GrossProfit#Duration_5_27_2024_To_5_25_2025_6f5macFeNEWHTQoY1aecyA",
        "formula": null,
        "notes": "SEC accession 0001104659-26-083905; prior-year YTD comparison column embedded in the current 10-Q."
      }
    },
    {
      "metric_id": "operating_profit_before_investment_activities",
      "name": "Operating Income",
      "value": 1364.6,
      "unit": "million_usd",
      "period": "2025-FY",
      "comparison_value": null,
      "comparison_period": null,
      "change": null,
      "change_unit": null,
      "data_type": "direct",
      "status": "available",
      "reason": null,
      "provenance": {
        "source_file": "raw/sec-filings/CAG/0001104659-26-083905.json",
        "source_type": "sec_inline_xbrl",
        "source_id": "sec-0001104659-26-083905",
        "page": null,
        "sheet": "income_statement",
        "cell_or_range": "http://fasb.org/us-gaap/2025:OperatingIncomeLoss#Duration_5_27_2024_To_5_25_2025_6f5macFeNEWHTQoY1aecyA",
        "formula": null,
        "notes": "SEC accession 0001104659-26-083905; prior-year YTD comparison column embedded in the current 10-Q."
      }
    },
    {
      "metric_id": "operating_profit",
      "name": "Operating Income",
      "value": 1364.6,
      "unit": "million_usd",
      "period": "2025-FY",
      "comparison_value": null,
      "comparison_period": null,
      "change": null,
      "change_unit": null,
      "data_type": "direct",
      "status": "available",
      "reason": null,
      "provenance": {
        "source_file": "raw/sec-filings/CAG/0001104659-26-083905.json",
        "source_type": "sec_inline_xbrl",
        "source_id": "sec-0001104659-26-083905",
        "page": null,
        "sheet": "income_statement",
        "cell_or_range": "http://fasb.org/us-gaap/2025:OperatingIncomeLoss#Duration_5_27_2024_To_5_25_2025_6f5macFeNEWHTQoY1aecyA",
        "formula": null,
        "notes": "SEC accession 0001104659-26-083905; prior-year YTD comparison column embedded in the current 10-Q."
      }
    },
    {
      "metric_id": "profit_before_tax",
      "name": "Income Before Tax",
      "value": 1156.2,
      "unit": "million_usd",
      "period": "2025-FY",
      "comparison_value": null,
      "comparison_period": null,
      "change": null,
      "change_unit": null,
      "data_type": "direct",
      "status": "available",
      "reason": null,
      "provenance": {
        "source_file": "raw/sec-filings/CAG/0001104659-26-083905.json",
        "source_type": "sec_inline_xbrl",
        "source_id": "sec-0001104659-26-083905",
        "page": null,
        "sheet": "income_statement",
        "cell_or_range": "http://fasb.org/us-gaap/2025:IncomeLossFromContinuingOperationsBeforeIncomeTaxesExtraordinaryItemsNoncontrollingInterest#Duration_5_27_2024_To_5_25_2025_6f5macFeNEWHTQoY1aecyA",
        "formula": null,
        "notes": "SEC accession 0001104659-26-083905; prior-year YTD comparison column embedded in the current 10-Q."
      }
    },
    {
      "metric_id": "tax_expense_total",
      "name": "Income Tax Expense",
      "value": -3.7,
      "unit": "million_usd",
      "period": "2025-FY",
      "comparison_value": null,
      "comparison_period": null,
      "change": null,
      "change_unit": null,
      "data_type": "direct",
      "status": "available",
      "reason": null,
      "provenance": {
        "source_file": "raw/sec-filings/CAG/0001104659-26-083905.json",
        "source_type": "sec_inline_xbrl",
        "source_id": "sec-0001104659-26-083905",
        "page": null,
        "sheet": "income_statement",
        "cell_or_range": "http://fasb.org/us-gaap/2025:IncomeTaxExpenseBenefit#Duration_5_27_2024_To_5_25_2025_6f5macFeNEWHTQoY1aecyA",
        "formula": null,
        "notes": "SEC accession 0001104659-26-083905; prior-year YTD comparison column embedded in the current 10-Q."
      }
    },
    {
      "metric_id": "net_profit_for_period",
      "name": "Net Income",
      "value": 1152.5,
      "unit": "million_usd",
      "period": "2025-FY",
      "comparison_value": null,
      "comparison_period": null,
      "change": null,
      "change_unit": null,
      "data_type": "direct",
      "status": "available",
      "reason": null,
      "provenance": {
        "source_file": "raw/sec-filings/CAG/0001104659-26-083905.json",
        "source_type": "sec_inline_xbrl",
        "source_id": "sec-0001104659-26-083905",
        "page": null,
        "sheet": "income_statement",
        "cell_or_range": "http://fasb.org/us-gaap/2025:ProfitLoss#Duration_5_27_2024_To_5_25_2025_6f5macFeNEWHTQoY1aecyA",
        "formula": null,
        "notes": "SEC accession 0001104659-26-083905; prior-year YTD comparison column embedded in the current 10-Q."
      }
    },
    {
      "metric_id": "net_profit_attributable_parent",
      "name": "Net Income Attributable to Parent",
      "value": 1152.4,
      "unit": "million_usd",
      "period": "2025-FY",
      "comparison_value": null,
      "comparison_period": null,
      "change": null,
      "change_unit": null,
      "data_type": "direct",
      "status": "available",
      "reason": null,
      "provenance": {
        "source_file": "raw/sec-filings/CAG/0001104659-26-083905.json",
        "source_type": "sec_inline_xbrl",
        "source_id": "sec-0001104659-26-083905",
        "page": null,
        "sheet": "income_statement",
        "cell_or_range": "http://fasb.org/us-gaap/2025:NetIncomeLoss#Duration_5_27_2024_To_5_25_2025_6f5macFeNEWHTQoY1aecyA",
        "formula": null,
        "notes": "SEC accession 0001104659-26-083905; prior-year YTD comparison column embedded in the current 10-Q."
      }
    },
    {
      "metric_id": "eps_basic_usc",
      "name": "Basic Earnings per Share",
      "value": 2.41,
      "unit": "usd_per_share",
      "period": "2025-FY",
      "comparison_value": null,
      "comparison_period": null,
      "change": null,
      "change_unit": null,
      "data_type": "direct",
      "status": "available",
      "reason": null,
      "provenance": {
        "source_file": "raw/sec-filings/CAG/0001104659-26-083905.json",
        "source_type": "sec_inline_xbrl",
        "source_id": "sec-0001104659-26-083905",
        "page": null,
        "sheet": "income_statement",
        "cell_or_range": "http://fasb.org/us-gaap/2025:EarningsPerShareBasic#Duration_5_27_2024_To_5_25_2025_6f5macFeNEWHTQoY1aecyA",
        "formula": null,
        "notes": "SEC accession 0001104659-26-083905; prior-year YTD comparison column embedded in the current 10-Q."
      }
    },
    {
      "metric_id": "eps_diluted_usc",
      "name": "Diluted Earnings per Share",
      "value": 2.4,
      "unit": "usd_per_share",
      "period": "2025-FY",
      "comparison_value": null,
      "comparison_period": null,
      "change": null,
      "change_unit": null,
      "data_type": "direct",